<?xml version="1.0" encoding="utf-8" standalone="no"?>
<?xml-stylesheet type="text/xsl" href="addressbook-to-html.xsl"?>
<addressbook title="addressbook" xmlns:xsi="http://www.w3.org/2001/XMLSchema-instance" xsi:noNamespaceSchemaLocation="address-book.xsd">
    <person>
        <name>
            <firstname>Emrick</firstname>
            <lastname>Hamlin</lastname>
        </name>
        <contact>
            <email>emric-haml@yahoo.com</email>
            <phonenumber type="work">+5553004487</phonenumber>
            <website>www.google.com</website>
            <other>
                <nameofservice>Skype</nameofservice>
                <userid>emrickham</userid>
            </other>
        </contact>
        <address>
            <street>Silent Lagoon</street>
            <doornumber>1953</doornumber>
            <postalnumber>677152937</postalnumber>
            <city>New York</city>
            <state>US</state>
        </address>
    </person>

    <person>
        <name>
            <firstname>Malka</firstname>
            <lastname>Plumb</lastname>
        </name>
        <contact>
            <phonenumber>+5553774253</phonenumber>
        </contact>
        <notes>Burrow under covers eats owners hair then claws head, missing until dinner time plays league of legends and kitty ipsum dolor sit amet, shed everywhere shed everywhere stretching attack your ankles chase the red dot, hairball run catnip eat the grass sniff give attitude, for rub whiskers on bare skin act innocent. Have secret plans eat and than sleep on your face, yet claws in your leg. Missing until dinner time. Asdflkjaertvlkjasntvkjn (sits on keyboard) man running from cops stops to pet cats, goes to jail. Cats making all the muffins. </notes>
    </person>

    <person>
        <name>
            <firstname>Efrain</firstname>
            <middlename>Harbour</middlename>
            <lastname>Lybarger</lastname>
        </name>
        <contact>
            <email>elflyb@gmail.com</email>
            <phonenumber type="work">8488811</phonenumber>
            <phonenumber type="personal">+5554569874</phonenumber>
            <phonenumber>+5553211479</phonenumber>
            <other>
                <nameofservice>ICQ</nameofservice>
                <userid>632489025</userid>
            </other>
        </contact>
        <address>
            <street>Pleasant Nectar St.</street>
            <doornumber>658</doornumber>
            <postalnumber>327945582</postalnumber>
            <city>Seattle</city>
            <state>United States</state>
        </address>
    </person>

    <person>
        <name>
            <firstname>Shah </firstname>
            <lastname>Watkins</lastname>
        </name>
        <contact>
            <email>shah_wa@toodles.com</email>
            <email>shahahah@gmail.com</email>
            <email>watkinss@yahoo.com</email>
            <website>haha.com</website>
            <website>hehe.com</website>
        </contact>
        <notes>Bulbasaur Lorem ipsum dolor sit amet, consectetur adipiscing elit. Ivysaur Lorem ipsum dolor sit amet, consectetur adipiscing elit. Venusaur Lorem ipsum dolor sit amet, consectetur adipiscing elit. Charmander Lorem ipsum dolor sit amet, consectetur adipiscing elit.</notes>
    </person>

    <person>
        <name>
            <firstname>Reinhard</firstname>
            <middlename>Green</middlename>
            <lastname>Hibbard</lastname>
        </name>
        <contact>
            <phonenumber type="personal">9014669746</phonenumber>
            <other>
                <nameofservice>Skype</nameofservice>
                <userid>hibbi</userid>
            </other>
            <other>
                <nameofservice>ICQ</nameofservice>
                <userid>160258943</userid>
            </other>
        </contact>
        <address>
            <street>Gentle Grounds</street>
            <doornumber>1912</doornumber>
            <postalnumber>654652</postalnumber>
            <city>Highway Village</city>
            <state>Canada</state>
        </address>
        <notes>Northern squawfish skate, cod icefish, bass ricefish; murray cod. Mustache triggerfish combtail gourami queen danio damselfish frilled shark. </notes>
    </person>
</addressbook>