<?xml version="1.0" encoding="utf-8" standalone="no"?>
<?xml-stylesheet type="text/xsl" href="addrssbook-to-html.xsl"?>
<addressbook xmlns:xsi="http://www.w3.org/2001/XMLSchema-instance"
             xsi:noNamespaceSchemaLocation="address-book.xsd">
<person>
    <name>
        <firstname>Sona</firstname>
        <middlename></middlename>
        <lastname>Leitmanova</lastname>
    </name>
    <contact>
        <email>sona.leitmanova@gmail.com</email>
        <phonenumber type="personal">+421908607121</phonenumber>
        <phonenumber>+420607123104</phonenumber>
        <website></website>
        <other>
            <nameofservice>ICQ</nameofservice>
            <userid>301283667</userid>
        </other>
    </contact>
    <address>
        <street>Chodska</street>
        <doornumber>7</doornumber>
        <postalnumber>61200</postalnumber>
        <city>Brno</city>
        <state>Czech Republic</state>
    </address>
    <notes>lalala</notes>
</person>
</addressbook>
